{
  "schemaVersion": "1.0.0",
  "asOf": "2026-09-04",
  "markets": ["US", "CA"],
  "billingCurrency": "USD",
  "policy": {
    "publicStatuses": ["ready_live"],
    "defaultStatus": "hidden_pending_qa",
    "chargeTiming": "after_supported_scope_and_qa_pass",
    "unknownOrUnsupportedAnswer": "no_charge",
    "failedQa": "no_charge",
    "duplicateSubmission": "single_idempotent_charge_only",
    "externalCommunityText": "demand_context_only",
    "factualClaims": "publisher_or_primary_evidence_required"
  },
  "products": [
    {
      "id": "poe2-build-decision-review",
      "gameId": "poe2",
      "label": "POE2 Build Decision Review",
      "credits": 120,
      "deliveryClass": "standard_source_review",
      "status": "hidden_pending_qa",
      "output": "A patch-scoped build diagnosis with the first verified bottleneck, prioritized repairs, evidence, assumptions, and a retest plan.",
      "requiredInputs": ["currentPatch", "buildDescription", "targetContent", "observedProblem", "budget"],
      "evidenceRequirements": ["Current official POE2 patch source", "Inspectable build or complete build description", "Target encounter or progression context"],
      "qaRequirements": ["Independent claim review", "Patch and item dependency check", "No best-in-slot guarantee", "Customer-visible limitations"],
      "activationGates": ["Twenty shadow-mode cases", "At least 90% supported-case QA pass rate", "No critical factual drift in the latest ten cases"],
      "noChargeReasons": ["Build cannot be inspected", "Patch or target content is unknown", "Required interaction lacks primary evidence", "Independent QA blocks delivery"]
    },
    {
      "id": "palworld-base-progression-review",
      "gameId": "palworld",
      "label": "Palworld Base and Progression Review",
      "credits": 80,
      "deliveryClass": "bounded_decision_review",
      "status": "ready_live",
      "output": "A version-scoped base or progression diagnosis with one bottleneck, practical next actions, assumptions, and a verification checklist.",
      "requiredInputs": ["gameVersion", "serverType", "currentGoal", "baseOrProgressionState", "observedProblem"],
      "evidenceRequirements": ["Current Pocketpair update source", "Player-supplied base or progression state", "Server or save context"],
      "qaRequirements": ["Independent claim review", "Version and server-scope check", "No exploit-dependent advice", "Customer-visible limitations"],
      "activationGates": ["Fifteen shadow-mode cases", "At least 90% supported-case QA pass rate", "No critical factual drift in the latest ten cases"],
      "noChargeReasons": ["Version or server scope is missing", "The problem cannot be reproduced from supplied context", "Advice depends on an unverified exploit", "Independent QA blocks delivery"]
    },
    {
      "id": "project-zomboid-save-plan-review",
      "gameId": "project-zomboid",
      "label": "Project Zomboid Save and Sandbox Change Review",
      "credits": 80,
      "deliveryClass": "bounded_decision_review",
      "status": "hidden_pending_qa",
      "output": "A build-scoped change plan covering backup, compatibility evidence, controlled testing, rollback, and stop conditions.",
      "requiredInputs": ["currentBuild", "requestedChange", "modList", "saveImportance", "backupStatus"],
      "evidenceRequirements": ["Current official Project Zomboid build source", "Exact requested change", "Mod and backup context"],
      "qaRequirements": ["Independent safety review", "No claim that a backup is guaranteed", "Build compatibility check", "Explicit rollback boundary"],
      "activationGates": ["Fifteen shadow-mode cases", "At least 90% supported-case QA pass rate", "Zero destructive-save recommendations"],
      "noChargeReasons": ["Current build is unknown", "Requested change is not specific", "The save has no inspectable rollback context", "Independent QA blocks delivery"]
    },
    {
      "id": "escape-from-tarkov-loadout-route-review",
      "gameId": "escape-from-tarkov",
      "label": "Tarkov Loadout and Route Decision Review",
      "credits": 120,
      "deliveryClass": "standard_source_review",
      "status": "hidden_pending_qa",
      "output": "A patch- and account-scoped loadout or quest-route comparison with replacement budget, alternatives, evidence, and stop conditions.",
      "requiredInputs": ["currentPatch", "mode", "accountAccess", "mapOrTask", "budget", "availableEquipment"],
      "evidenceRequirements": ["Current Battlestate or publisher Steam source", "Player's trader and equipment access", "Exact map, task, and mode context"],
      "qaRequirements": ["Independent factual review", "No hidden or unverified price claim", "No cheat or exploit advice", "Customer-visible uncertainty"],
      "activationGates": ["Twenty shadow-mode cases", "At least 90% supported-case QA pass rate", "Current-patch source freshness under 72 hours"],
      "noChargeReasons": ["Account access or game mode is missing", "Current price or task requirement cannot be verified", "Request depends on cheating or an exploit", "Independent QA blocks delivery"]
    },
    {
      "id": "ark-survival-ascended-roster-plan-review",
      "gameId": "ark-survival-ascended",
      "label": "ARK Roster and Server Plan Review",
      "credits": 120,
      "deliveryClass": "standard_source_review",
      "status": "hidden_pending_qa",
      "output": "A server-scoped taming, breeding, saddle, or boss-roster plan with user-entered rates, material budget, risks, and a test plan.",
      "requiredInputs": ["gameVersion", "map", "serverRates", "activeMods", "targetCreatureOrEncounter", "currentResources"],
      "evidenceRequirements": ["Current Studio Wildcard or publisher Steam source", "Exact server settings and mods", "Player-supplied blueprint or roster values when used"],
      "qaRequirements": ["Independent calculation review", "Server and mod scope check", "No universal official-rate assumption", "Customer-visible limitations"],
      "activationGates": ["Twenty shadow-mode cases", "All material calculations reproduced independently", "At least 90% supported-case QA pass rate"],
      "noChargeReasons": ["Server rates or active mods are unknown", "Blueprint values are not supplied", "Current encounter requirements cannot be verified", "Independent QA blocks delivery"]
    },
    {
      "id": "warframe-build-progression-review",
      "gameId": "warframe",
      "label": "Warframe Build and Progression Review",
      "credits": 120,
      "deliveryClass": "standard_source_review",
      "status": "hidden_pending_qa",
      "output": "A current-patch account and build review identifying the first bottleneck, upgrade order, evidence, resource risks, and a retest activity.",
      "requiredInputs": ["currentPatch", "accountProgress", "loadout", "targetActivity", "observedProblem", "availableResources"],
      "evidenceRequirements": ["Current Digital Extremes patch source", "Inspectable loadout or complete mod description", "Target mission and account unlock context"],
      "qaRequirements": ["Independent build review", "Current ability and mod dependency check", "No universal meta claim", "Customer-visible limitations"],
      "activationGates": ["Twenty shadow-mode cases", "At least 90% supported-case QA pass rate", "No critical dependency omissions in the latest ten cases"],
      "noChargeReasons": ["Loadout or target activity cannot be inspected", "Account unlock state is missing", "Current interaction cannot be supported by primary evidence", "Independent QA blocks delivery"]
    },
    {
      "id": "once-human-scenario-build-review",
      "gameId": "once-human",
      "label": "Once Human Scenario and Build Review",
      "credits": 80,
      "deliveryClass": "bounded_decision_review",
      "status": "hidden_pending_qa",
      "output": "A current-version scenario or build decision covering carryover, constraints, bottlenecks, alternatives, and an explicit verification plan.",
      "requiredInputs": ["currentVersion", "currentScenario", "candidateScenarioOrBuild", "accountOrCharacterState", "goal"],
      "evidenceRequirements": ["Current NetEase or publisher Steam source", "Exact source and destination scenario or build", "Account and character context"],
      "qaRequirements": ["Independent carryover or build review", "No irreversible-action claim without official support", "Version check", "Customer-visible limitations"],
      "activationGates": ["Fifteen shadow-mode cases", "At least 90% supported-case QA pass rate", "Zero unsupported carryover claims"],
      "noChargeReasons": ["Scenario or version is unknown", "Carryover wording does not cover the requested transition", "Account state is incomplete", "Independent QA blocks delivery"]
    },
    {
      "id": "counter-strike-2-round-plan-review",
      "gameId": "counter-strike-2",
      "label": "CS2 Round and Team Plan Review",
      "credits": 180,
      "deliveryClass": "complex_match_review",
      "status": "hidden_pending_qa",
      "output": "A demo- or evidence-based review of economy, role, utility, spacing, timing, and the first repeatable decision to change.",
      "requiredInputs": ["currentPatch", "matchMode", "map", "roundOrDemoEvidence", "playerRole", "reviewQuestion"],
      "evidenceRequirements": ["Current Valve update source", "Inspectable demo, round sequence, or complete timestamps", "Map, side, economy, and role context"],
      "qaRequirements": ["Independent replay review", "No anti-cheat evasion or exploit advice", "Observation separated from inference", "Customer-visible limitations"],
      "activationGates": ["Twenty-five shadow-mode cases", "At least 90% supported-case QA pass rate", "Inter-reviewer agreement on the first decision in at least 80% of benchmark cases"],